{
  "id": "nnor",
  "status": "playtest",
  "name": "Nnor",
  "cover": "nnor-3_4-og.png",
  "banner": "nnor-16_9-og.png",
  "movement": "10,5 m",
  "types": [
    "humanoid",
    "beast"
  ],
  "size": [
    "medium"
  ],
  "languages": [
    "common",
    "draconic"
  ],
  "offered": [
    "COUSAB-001",
    "ECHTRI-001"
  ],
  "subspeciesLabel": "subspecies",
  "familyNames": [
    "Aktharos",
    "Araskha",
    "Borsanth",
    "Chrythos",
    "Dornal",
    "Ebranis",
    "Farketh",
    "Ghalcor",
    "Harsian",
    "Ithoron",
    "Jaskiron",
    "Kervas",
    "Lythoros",
    "Manthar",
    "Noralis",
    "Othran",
    "Parthos",
    "Qyrados",
    "Rhosian",
    "Salthor",
    "Terynth",
    "Uroska",
    "Voxaran",
    "Weryth",
    "Xandros",
    "Yrthos",
    "Zoralan"
  ],
  "familyNamesLabel": "Yurtas",
  "subspecies": [
    {
      "id": "alpin",
      "name": "Nnor alpin",
      "text": "***En tant que Nnor alpin***, vous venez d'une Yurta qui élit elle-même son Saman, sans Dragonnor au-dessus de lui, et où chacun prend sa part des tâches. Votre fourrure est blanche, grise ou brun clair, avec parfois des reflets dorés ou roux comme le premier soleil sur les cimes, et vos yeux vont du vert mousse au bleu glacier. Les vôtres sont commerçants et artisans : ils descendent des pentes enneigées jusqu'aux foires aux épices et aux étoffes pour y troquer peaux, métaux et objets d'art. Les citadins s'étonnent de leur honnêteté en affaires, et du soin qu'ils prennent à ne rien abîmer des sentiers que suivent leurs caravanes.",
      "names": {
        "masculine": [
          "Ariante",
          "Ate",
          "Anachar",
          "Argith",
          "Bakth",
          "Cerd",
          "Daurate",
          "Dask",
          "Gorg",
          "Haras",
          "Hekat",
          "Idanth",
          "Mar",
          "Mor",
          "Nart",
          "Oiorp",
          "Orot",
          "Parth",
          "Pasir",
          "Qarant",
          "Ranta",
          "Sart",
          "Scyl",
          "Spargapeith",
          "Tarkant",
          "Thargant",
          "Vaskar",
          "Yanth",
          "Zynth"
        ],
        "feminine": [
          "Anacharsia",
          "Api",
          "Argipane",
          "Artimpasa",
          "Asara",
          "Daurata",
          "Daskara",
          "Elyt",
          "Gyrant",
          "Harat",
          "Hekatae",
          "Idantha",
          "Jaryta",
          "Karamat",
          "Lyrant",
          "Lyrt",
          "Maraspan",
          "Morata",
          "Nartana",
          "Oiorpata",
          "Parast",
          "Pasiara",
          "Qaranta",
          "Rantasa",
          "Sartana",
          "Skolila",
          "Spargapana",
          "Tarkanta",
          "Vaskara",
          "Yanthia"
        ]
      },
      "offered": [
        "ENDALP-001",
        "PERRUS-001",
        "AGIMON-001"
      ]
    },
    {
      "id": "charon",
      "name": "Nnor de Charon",
      "text": "***En tant que Nnor de Charon***, vous appartenez à la lignée restée fidèle au Dragon Primordial du Feu. Dans votre Yurta, les ouvriers obéissent au Saman, et le Saman au Dragonnor qui l'a fondée, un ancien Saman que le Rituel du Feu a transformé dans l'Antre de Charon, sur le mont Edros. Votre toison d'un noir d'encre est striée de fines veines rougeoyantes, vos yeux ont l'éclat pourpre d'une braise et vos cornes la couleur du charbon. Vous êtes né d'un œuf pondu par le Dragonnor de votre Yurta, et vous n'en pondez aucun. Le silence des galeries souterraines vous est familier, et c'est à l'ombre des volcans siffleurs que votre Yurta célèbre sa dévotion à Charon.",
      "names": {
        "given": [
          "Azhoran",
          "Bzharix",
          "Cyrion",
          "Draketh",
          "Eshir",
          "Fyrious",
          "Gharoth",
          "Hozhen",
          "Izhol",
          "Jorak",
          "Krynis",
          "Lozhern",
          "Myrinth",
          "Nyrath",
          "Ozhira",
          "Pyrion",
          "Qharix",
          "Rhoxal",
          "Syzira",
          "Thazur",
          "Uzhon",
          "Vyneth",
          "Wyxar",
          "Xharis",
          "Yzharun",
          "Zyrion",
          "Brashal",
          "Crithen",
          "Dravon",
          "Fronar"
        ]
      },
      "offered": [
        "FORDRA-001",
        "LEGCHA-001",
        "INSTRI-001"
      ]
    }
  ],
  "roleplay": {
    "adulthood": "Vers 50 ans pour un Nnor de Charon, un peu plus tôt pour un Nnor alpin",
    "lifespan": "Entre 700 et 800 ans",
    "height": "Entre 1,70 m et 2,10 m"
  }
}
